{
  "schemaVersion": "1.0.0",
  "visitId": "7c4e1b9a-2d3f-4a68-9b5c-e0f1a2b3c4d5",
  "captureId": "a81d5f03-6c2e-4b97-8d14-2f9e7b3c5a60",
  "areaKey": "floor-2",
  "startedAt": "2026-10-17T14:30:05Z",
  "finishedAt": "2026-10-17T14:41:52Z",
  "video": {
    "path": "Original Exports/floor-2/a81d5f03-6c2e-4b97-8d14-2f9e7b3c5a60/walkthrough.mp4",
    "width": 1280,
    "height": 960,
    "framesPerSecond": 15
  },
  "intrinsics": {
    "fx": 1018.4,
    "fy": 1018.4,
    "cx": 640.2,
    "cy": 479.6,
    "width": 1280,
    "height": 960
  },
  "floorY": -1.412,
  "frames": [
    {
      "t": 0.0,
      "transform": [1.0, 0, -0.0, 0, 0, 1, 0, 0, 0.0, 0, 1.0, 0, 0.0, 0, -0.0, 1],
      "tracking": "normal"
    },
    {
      "t": 0.5,
      "transform": [
        0.980067, 0, -0.198669, 0, 0, 1, 0, 0, 0.198669, 0, 0.980067, 0, 0.3, 0, -0.2, 1
      ],
      "tracking": "normal"
    },
    {
      "t": 1.0,
      "transform": [
        0.921061, 0, -0.389418, 0, 0, 1, 0, 0, 0.389418, 0, 0.921061, 0, 0.6, 0, -0.4, 1
      ],
      "tracking": "normal"
    },
    {
      "t": 1.5,
      "transform": [
        0.825336, 0, -0.564642, 0, 0, 1, 0, 0, 0.564642, 0, 0.825336, 0, 0.9, 0, -0.6, 1
      ],
      "tracking": "limited"
    },
    {
      "t": 2.0,
      "transform": [
        0.696707, 0, -0.717356, 0, 0, 1, 0, 0, 0.717356, 0, 0.696707, 0, 1.2, 0, -0.8, 1
      ],
      "tracking": "normal"
    },
    {
      "t": 2.5,
      "transform": [
        0.540302, 0, -0.841471, 0, 0, 1, 0, 0, 0.841471, 0, 0.540302, 0, 1.5, 0, -1.0, 1
      ],
      "tracking": "normal"
    }
  ],
  "rooms": [
    {
      "id": "room-1",
      "label": "Bedroom",
      "type": "bedroom",
      "method": "corners",
      "corners": [
        {
          "p": [0.004, -1.412, -0.003],
          "t": 12.4,
          "tracking": "normal"
        },
        {
          "p": [4.012, -1.412, 0.006],
          "t": 19.8,
          "tracking": "normal"
        },
        {
          "p": [4.006, -1.412, -3.009],
          "t": 27.1,
          "tracking": "normal"
        },
        {
          "p": [-0.007, -1.412, -2.996],
          "t": 33.9,
          "tracking": "normal"
        }
      ],
      "closingTap": {
        "p": [0.031, -1.412, 0.022],
        "t": 41.2,
        "tracking": "normal"
      },
      "ceiling": [
        {
          "p": [2.0, 1.029, -3.002],
          "t": 48.0,
          "tracking": "normal"
        },
        {
          "p": [4.004, 1.025, -1.5],
          "t": 52.6,
          "tracking": "normal"
        }
      ],
      "openings": [
        {
          "id": "door-1",
          "kind": "door",
          "wallIndex": 2,
          "leftJamb": {
            "p": [3.694, -1.412, -3.004],
            "t": 60.1,
            "tracking": "normal"
          },
          "rightJamb": {
            "p": [2.881, -1.412, -3.002],
            "t": 63.4,
            "tracking": "normal"
          },
          "head": {
            "p": [3.29, 0.619, -3.003],
            "t": 66.0,
            "tracking": "normal"
          }
        },
        {
          "id": "window-1",
          "kind": "window",
          "wallIndex": 0,
          "leftJamb": {
            "p": [1.868, -0.012, 0.001],
            "t": 71.2,
            "tracking": "normal"
          },
          "rightJamb": {
            "p": [2.782, -0.012, 0.002],
            "t": 74.0,
            "tracking": "normal"
          },
          "sill": {
            "p": [2.3, -0.498, 0.0],
            "t": 76.5,
            "tracking": "normal"
          },
          "head": {
            "p": [2.3, 0.721, 0.001],
            "t": 79.1,
            "tracking": "normal"
          }
        }
      ]
    },
    {
      "id": "room-2",
      "label": "Closet",
      "type": "closet",
      "method": "walls",
      "walls": [
        [
          {
            "p": [-0.12, -1.412, -1.0],
            "t": 90.0,
            "tracking": "normal"
          },
          {
            "p": [-0.12, -1.412, -2.4],
            "t": 92.0,
            "tracking": "normal"
          }
        ],
        [
          {
            "p": [-0.3, -1.412, -2.52],
            "t": 94.5,
            "tracking": "normal"
          },
          {
            "p": [-0.6, -1.412, -2.521],
            "t": 96.1,
            "tracking": "normal"
          }
        ],
        [
          {
            "p": [-0.82, -1.412, -2.2],
            "t": 98.4,
            "tracking": "normal"
          },
          {
            "p": [-0.819, -1.412, -1.1],
            "t": 100.2,
            "tracking": "normal"
          }
        ],
        [
          {
            "p": [-0.5, -1.412, -0.751],
            "t": 102.6,
            "tracking": "normal"
          },
          {
            "p": [-0.25, -1.412, -0.75],
            "t": 104.0,
            "tracking": "normal"
          }
        ]
      ],
      "ceiling": [],
      "openings": [
        {
          "id": "door-2",
          "kind": "door",
          "wallIndex": 0,
          "leftJamb": {
            "p": [-0.12, -1.412, -1.3],
            "t": 108.0,
            "tracking": "normal"
          },
          "rightJamb": {
            "p": [-0.12, -1.412, -2.0],
            "t": 110.5,
            "tracking": "normal"
          }
        }
      ]
    }
  ],
  "scaleCheck": {
    "roomId": "room-1",
    "wallIndex": 0,
    "tape": {
      "valueMm": 4001,
      "enteredUnit": "ft_in",
      "enteredText": "13' 1.5\""
    }
  }
}
